title,snippet,link
Retail - Reliance Industries Ltd - Integrated Annual Report 2022 - 2023,These trends are a force multiplier for the Indian retail sector which currently stands at over $800 billion and is expected to grow at 11% CAGR to become a $2 ...,https://www.ril.com/ar2022-23/retail.html
Reliance Retail Market India – Digital | Electronics | Furniture,"Reliance Retail is the retail initiative of the group and an epicenter of our consumer facing businesses such as Digital, Electronics, Furniture, Jewellery, ...",https://www.ril.com/businesses/retail
Our Business - Reliance Retail,"Reliance Retail has adopted a multi-prong strategy and operates a wide array of store formats that cater to planned shopping needs, as well as daily or ...",https://relianceretail.com/our-business.html
"Reliance: India fastest growing retail market, to cross $1.4 trillion by ...","The sector's growth is driven by urbanisation, rising incomes, and evolving consumer preferences. Reliance Retail, recording 1.2 billion ...",https://m.economictimes.com/industry/services/retail/india-fastest-growing-retail-market-to-cross-1-4-trillion-by-2027-reliance/articleshow/112348795.cms
Reliance Trends,"Trends is India's largest fashion retail chain across India. Trends offers stylish, high-quality products across Womenswear, Menswear, Kidswear and fashion ...",https://relianceretail.com/reliance-trends.html
"Latest reliance digital , Information & Updates - ET Retail",RELIANCE DIGITAL · South India's cooling appliance market heats up; Brands expect double-digit growth · Join the community of 2M+ industry professionals · Download ...,https://retail.economictimes.indiatimes.com/tag/reliance+digital
Reliance Retail closes Q1 with fewer stores but footfall goes up by ...,"Reliance Retail Ventures Limited (RRVL) reported an 18.9% annual increase in footfalls in Q1 of FY25, with 296 million compared to 272 million in Q4 FY24.",https://m.economictimes.com/industry/services/retail/reliance-retail-closes-q1-with-fewer-stores-but-footfall-goes-up-by-18-9/articleshow/111866637.cms
"Retail Industry in India: Overview of Retail Sector, Market Size ... - IBEF","According to recent industry reports, the e-commerce industry witnessed a phenomenal 36.8% YoY growth in terms of order volumes. As consumers prefer to shop ...",https://www.ibef.org/industry/retail-india
Reliance Retail's digital segments see growth in earnings and ...,"Reliance Retail has had year-on-year (YoY) revenue growth of 19%, according to the company's financial results for the quarter 1 (Q1) of 2023 (April-June).",https://www.medianama.com/2023/07/223-reliance-financial-results-reliance-retails-digital-segments-see-growth-2/
"Rs 3,06,848 Crore Revenue Milestone! How Reliance Retail is ...","Retail & Business. Rs 3,06,848 Crore Revenue Milestone! How Reliance Retail is Dominating India's Retail Market with 17.8% Growth. Indian ...",https://www.indianretailer.com/article/retail-business/retail/rs-306848-crore-revenue-milestone-how-reliance-retail-dominating
Competitors Analysis of Reliance - LinkedIn,"Reliance Industries is into so many categories that it is competing with Google with Jio Pay, Dmart with Reliance Retail, Embibe with Byju's and many other ...",https://www.linkedin.com/pulse/competitors-analysis-reliance-aashi-parashar
Reliance Retail And Competitor Analysis Matrix Success Strategy Of ...,The slide showcases competitor analysis of reliance Retail business model which has been aiming to acquire customers through both online and ...,https://www.slideteam.net/reliance-retail-and-competitor-analysis-matrix-success-strategy-of-reliance-ppt-example-strategy-ss.html
"Reliance Digital's Competitors, Revenue, Number of Employees ...","Reliance Digital's primary competitors are Croma, Lakshmi Copier Solutions, Tata CLiQ and 7 more. Competitors. View 10 Reliance Digital competitors here.",https://www.owler.com/company/reliancedigital
[PDF] A Study on Customer Perception Towards Reliance Digital Retail ...,They have the electronics and consumer durables that customer needs . It was found that overall customer perception towards reliance digital store is good.,https://www.sdmimd.ac.in/incon_cd_2020/papers/MR114.pdf
Reliance Retail - A Fresh Approach Towards Retailing in India - Scribd,"RIL established Reliance Retail in 2006, which has become India's second largest retailer. Reliance Retail aims to integrate agriculture and retail through its ...",https://www.scribd.com/doc/88145692/RELIANCE-RETAIL-A-FRESH-APPROACH-TOWARDS-RETAILING-IN-INDIA
Marketing Strategy Of Reliance - A 2024 Case Study । IIDE,"This case study focuses on Reliance Industries, Jio and its Retail business, along with their marketing mix, competitors analysis, marketing strategies and ...",https://iide.co/case-studies/reliance-marketing-strategy/
The Competitive Landscape of Reliance Retail - CBM,"Market Position: Reliance Retail is a dominant player in the Indian retail sector. · Key Competitors: Competitors include Walmart, Amazon, and ...",https://canvasbusinessmodel.com/blogs/competitors/reliance-retail-competitive-landscape
Top Reliance Digital Competitors and Alternatives | Craft.co,"Reliance Digital's competitors and similar companies include Lulu Mall, Masters Home Centre, Office 8 and Radio Popular. Reliance Digital Retail is a chain of ...",https://craft.co/reliance-digital/competitors
Reliance Retail SWOT Analysis - Key Strengths & Weaknesses,"SWOT analysis of Reliance Retail analyses the brand/company with its strengths, weaknesses, opportunities & threats.",https://www.mbaskool.com/swot-analysis/lifestyle-and-retail/4785-reliance-retail.html
"A little less artificial, a lot more intelligent - Reliance Digital","AI has also lot to do with our online shopping experiences. Shopping websites constantly maps user's searches, their buying patterns and tries to recommend ...",https://www.reliancedigital.in/solutionbox/artificial-intelligence-a-little-less-artificial-a-lot-more-intelligent/?srsltid=AfmBOoo3pScd9L_qdOq0OUZkGofL5Tgo7Z9yPEIwwGhIMIjShMGjWxGs
"Reliance Retail eyes blockchain for security, 5G for AR-powered in ...","Specific investment areas are AI/ML, data analytics, AR/VR, IoT, enhanced connectivity with 5G, robotics and automation and customer engagement ...",https://www.indiaretailing.com/2024/06/13/reliance-retail-suman-guha-cpto-interview/
Retail - Reliance Industries Ltd - Integrated Annual Report 2022 - 2023,AI/ML driven decision-making models help in improving customer experience. ... Reliance Retail with its industry leading store network and emerging digital ...,https://www.ril.com/ar2022-23/retail.html
AI and ML Revolutionising Indian Retail and E-commerce - LinkedIn,1. Personalised Shopping Experiences · 2. Enhanced Inventory Management · 3. Improved Customer Service · 4. Market Trend Analysis · 5. Fraud ...,https://www.linkedin.com/pulse/ai-ml-revolutionising-indian-retail-e-commerce-ruhbir-singh-00mtf
"Artificial Intelligence [AI] in Retail Market Size, Growth 2031.",The Artificial Intelligence in Retail Market was valued at $7 billion in 2023. This market is anticipated to reach $92.7 billion by 2031 from an estimated $9.4 ...,https://www.meticulousresearch.com/product/artificial-intelligence-in-retail-market-4979
Top 7 Ways in which Artificial Intelligence is Disrupting the Retail ...,"From offering a customer-centric buying experience to better retail system management, AI is offering possibilities in the industry like never before.",https://digitalaptech.com/top-7-ways-in-which-artificial-intelligence-is-disrupting-the-retail-industry/
"AI in retail: Use cases, applications, solution and implementation","Explore how AI redefines retail, enhancing profitability and operational efficiency. Discover use cases, benefits, and the promising future of AI in retail.",https://www.leewayhertz.com/ai-in-retail/
Real-Life Success Stories of Digital Transformation in Indian Retail,"AI-driven demand forecasting has improved inventory management, reducing stockouts and excess inventory. Flipkart's innovative use of AI has set ...",https://timespro.com/blog/real-life-success-stories-of-digital-transformation-in-indian-retail
Reliance Retail's Fashion Business Leverages AI To Expand Footprint,Reliance Retail plans to leverage data analytics and artificial intelligence to stock store-specific assortment within the next year.,https://inc42.com/buzz/reliance-retails-fashion-vertical-looks-to-leverage-ai-to-expand-footprint/
AI and ML in Retail: Revolutionizing Digital Operations in ... - Taqtics,"AI and ML are utilized for demand forecasting, inventory optimization, and personalized marketing in the retail consumer goods industry. These technologies ...",https://taqtics.co/ai-and-ml-in-retail/
